{
  "schema": 1,
  "suite": "external-floor",
  "measured": "2026-09-29T23:12:22.829Z",
  "commit": "2adfc253f108f7f3719ac730a8ef19dab22f9400-dirty",
  "machine": {
    "os": "linux",
    "release": "6.17.0-1022-azure",
    "arch": "x64",
    "cpu": "AMD EPYC 9V74 80-Core Processor",
    "cores": 4,
    "memoryGb": 16,
    "node": "v24.13.0",
    "ci": true
  },
  "axes": {
    "floor": {
      "status": "not-run",
      "reason": "not selected by --axis"
    }
  },
  "records": [],
  "bands": {},
  "claims": {}
}
