{
  "schema": 1,
  "suite": "external-floor",
  "measured": "2026-09-28T06:59:03.001Z",
  "commit": "e4c1f6951dcbc73d581ce1edce4cf3f9ae183058-dirty",
  "machine": {
    "os": "linux",
    "release": "6.17.0-1022-azure",
    "arch": "x64",
    "cpu": "INTEL(R) XEON(R) PLATINUM 8573C",
    "cores": 4,
    "memoryGb": 16,
    "node": "v24.13.0",
    "ci": true
  },
  "axes": {
    "floor": {
      "status": "not-run",
      "reason": "not selected by --axis"
    }
  },
  "records": [],
  "bands": {},
  "claims": {}
}
