{
  "schema": 1,
  "suite": "external-floor",
  "measured": "2026-10-08T22:34:56.831Z",
  "commit": "ba8a89c8465aa3a88b04c300ec08481520a865b2-dirty",
  "machine": {
    "os": "linux",
    "release": "6.17.0-1022-azure",
    "arch": "x64",
    "cpu": "AMD EPYC 7763 64-Core Processor",
    "cores": 4,
    "memoryGb": 16,
    "node": "v24.13.0",
    "ci": true
  },
  "axes": {
    "floor": {
      "status": "not-run",
      "reason": "not selected by --axis"
    }
  },
  "records": [],
  "bands": {},
  "claims": {}
}
