{
  "schema": 1,
  "suite": "external-floor",
  "measured": "2026-10-19T09:33:59.605Z",
  "commit": "28843a536a3ec3bcd4b201a47436c4c672a16b65-dirty",
  "machine": {
    "os": "linux",
    "release": "6.17.0-1022-azure",
    "arch": "x64",
    "cpu": "AMD EPYC 9V74 80-Core Processor",
    "cores": 4,
    "memoryGb": 16,
    "node": "v24.13.0",
    "ci": true
  },
  "axes": {
    "floor": {
      "status": "measured",
      "method": "The same demo program built on burgee, commander and yargs, handed to two third-party checkers pinned by version and archive digest (`benchmarks/floor-tools.ts`): clispec 0.3.0, the scorer for clispec.dev v0.3 (six principles, 24 points), and cli-agent-lint 0.3.5 (34 checks, weighted percentage). Each tool runs once per variant with active probing on, in an environment of PATH and an empty HOME only. Verdicts are recorded as the tools print them; nothing is re-scored. Burgee’s two scores are gated at their landing values as a ratchet."
    }
  },
  "records": [
    {
      "axis": "floor",
      "variant": "burgee",
      "metric": "clispec-score",
      "unit": "points",
      "samples": 1,
      "median": 24,
      "p95": 24,
      "gate": {
        "min": 24,
        "why": "N10: a change that loses a point on clispec.dev’s published checklist regresses the floor against someone else’s bar"
      },
      "note": "clispec 0.3.0 (clispec.dev v0.3): points out of 24, graded Excellent",
      "detail": {
        "tool": "clispec 0.3.0",
        "max": 24,
        "percentage": 100,
        "grade": "Excellent",
        "failed": ""
      }
    },
    {
      "axis": "floor",
      "variant": "burgee",
      "metric": "cli-agent-lint-score",
      "unit": "percent",
      "samples": 1,
      "median": 100,
      "p95": 100,
      "gate": {
        "min": 91,
        "why": "N10: a change that loses a check on cli-agent-lint’s 34 regresses the floor against someone else’s bar"
      },
      "note": "cli-agent-lint 0.3.5: weighted percentage over 34 checks, graded A",
      "detail": {
        "tool": "cli-agent-lint 0.3.5",
        "grade": "A",
        "checks": 34,
        "pass": 33,
        "warn": 0,
        "fail": 0,
        "skip": 1,
        "error": 0,
        "failed": ""
      }
    },
    {
      "axis": "floor",
      "variant": "burgee",
      "metric": "cli-agent-lint-held-checks-failing",
      "unit": "checks",
      "samples": 1,
      "median": 0,
      "p95": 0,
      "gate": {
        "max": 0,
        "why": "agent-skill C4 and agent-lint-conformance R8: SD-5 and FS-4 are held by name, so no other check can be traded for either"
      },
      "note": "cli-agent-lint 0.3.5: SD-5 and FS-4, held by name",
      "detail": {
        "tool": "cli-agent-lint 0.3.5",
        "held": "SD-5, FS-4",
        "failed": ""
      }
    },
    {
      "axis": "floor",
      "variant": "commander",
      "metric": "clispec-score",
      "unit": "points",
      "samples": 1,
      "median": 2,
      "p95": 2,
      "note": "clispec 0.3.0 (clispec.dev v0.3): points out of 24, graded Needs Work",
      "detail": {
        "tool": "clispec 0.3.0",
        "max": 24,
        "percentage": 8,
        "grade": "Needs Work",
        "failed": "JSON output flag [structured-output]; Valid JSON output [structured-output]; Structured or declared piped output [structured-output]; Structured errors [error-envelope]; Explicit format wins [structured-output]; schema command exists [schema-validates]; Valid JSON schema [schema-validates]; Validates against clispec v0.3 [schema-validates]; Error kinds documented [schema-validates]; Output fields declared [schema-validates]; Global args declared [schema-validates]; Exit codes on error kinds [schema-validates]; Effects on all commands [schema-validates]; schema mentioned in --help [help-mentions-schema]; schema works without config [schema-offline]; Clean stdout when piped [stream-separation]; Messages on stderr only [stream-separation]; Effects declarations [idempotent-repeats]; Idempotent conflict contract [idempotent-repeats]; Cardinality declarations [bounded-lists]; Unbounded pagination declarations [bounded-lists]; Unbounded field selection [bounded-lists]"
      }
    },
    {
      "axis": "floor",
      "variant": "commander",
      "metric": "cli-agent-lint-score",
      "unit": "percent",
      "samples": 1,
      "median": 71.2,
      "p95": 71.2,
      "note": "cli-agent-lint 0.3.5: weighted percentage over 34 checks, graded B",
      "detail": {
        "tool": "cli-agent-lint 0.3.5",
        "grade": "B",
        "checks": 34,
        "pass": 22,
        "warn": 6,
        "fail": 5,
        "skip": 1,
        "error": 0,
        "failed": "TE-3 --no-color flag (warn): no --no-color flag or NO_COLOR support detected; TE-4 --quiet / --silent flag (info): no --quiet or --silent flag detected; SD-1 Error format is structured (warn): stderr is not valid JSON: error: unknown option '--json'; SD-3 Shell completions available (info): no completion subcommand or flag found; SD-4 Schema / describe introspection (warn): no schema/describe introspection subcommands or flags found; SD-5 Skill / context files (info): no skill/context files found near the binary; SD-6 Help text with usage examples (warn): no Examples section found in any command's help text; SD-7 Actionable error messages (warn): error output lacks actionable guidance: \"error: unknown command '__nonexistent_subcommand__'\"; SA-3 Rejects control characters (warn): command \"demo-commander greet\" accepted control character input without error (exit code 0); PV-1 Timeout flag (info): no --timeout or --request-timeout flag found; PV-4 Distinct exit codes for error classes (info): no exit code documentation found in help text"
      }
    },
    {
      "axis": "floor",
      "variant": "yargs",
      "metric": "clispec-score",
      "unit": "points",
      "samples": 1,
      "median": 2,
      "p95": 2,
      "note": "clispec 0.3.0 (clispec.dev v0.3): points out of 24, graded Needs Work",
      "detail": {
        "tool": "clispec 0.3.0",
        "max": 24,
        "percentage": 8,
        "grade": "Needs Work",
        "failed": "JSON output flag [structured-output]; Valid JSON output [structured-output]; Structured or declared piped output [structured-output]; Structured errors [error-envelope]; Explicit format wins [structured-output]; schema command exists [schema-validates]; Valid JSON schema [schema-validates]; Validates against clispec v0.3 [schema-validates]; Error kinds documented [schema-validates]; Output fields declared [schema-validates]; Global args declared [schema-validates]; Exit codes on error kinds [schema-validates]; Effects on all commands [schema-validates]; schema mentioned in --help [help-mentions-schema]; schema works without config [schema-offline]; Clean stdout when piped [stream-separation]; Messages on stderr only [stream-separation]; Effects declarations [idempotent-repeats]; Idempotent conflict contract [idempotent-repeats]; Cardinality declarations [bounded-lists]; Unbounded pagination declarations [bounded-lists]; Unbounded field selection [bounded-lists]"
      }
    },
    {
      "axis": "floor",
      "variant": "yargs",
      "metric": "cli-agent-lint-score",
      "unit": "percent",
      "samples": 1,
      "median": 70.9,
      "p95": 70.9,
      "note": "cli-agent-lint 0.3.5: weighted percentage over 34 checks, graded B",
      "detail": {
        "tool": "cli-agent-lint 0.3.5",
        "grade": "B",
        "checks": 34,
        "pass": 21,
        "warn": 4,
        "fail": 6,
        "skip": 3,
        "error": 0,
        "failed": "TE-1 JSON output support (fail): no --output/--format/--json/-o flag with JSON support found in any command; TE-3 --no-color flag (warn): no --no-color flag or NO_COLOR support detected; TE-4 --quiet / --silent flag (info): no --quiet or --silent flag detected; SD-3 Shell completions available (info): no completion subcommand or flag found; SD-4 Schema / describe introspection (warn): no schema/describe introspection subcommands or flags found; SD-5 Skill / context files (info): no skill/context files found near the binary; SD-6 Help text with usage examples (warn): no Examples section found in any command's help text; SD-7 Actionable error messages (warn): error output lacks actionable guidance: \"demo <command>\\n\\nCommands:\\n  demo greet <name>  Greet someone\\n  demo config        Read configuration\\n  demo fail          Fail on purpose\\n\\nOptions:\\n  --help     Show help                              ...\"; PV-1 Timeout flag (info): no --timeout or --request-timeout flag found; PV-4 Distinct exit codes for error classes (info): no exit code documentation found in help text"
      }
    }
  ],
  "bands": {},
  "claims": {}
}
