{
  "schema": 1,
  "suite": "agent-cli-bench",
  "measured": "2026-09-13T16:28:34.812Z",
  "commit": "cf637a8221cb08c5a0e6b631dbe2005256e9dcf8-dirty",
  "machine": {
    "os": "linux",
    "release": "6.17.0-1022-azure",
    "arch": "x64",
    "cpu": "AMD EPYC 9V74 80-Core Processor",
    "cores": 4,
    "memoryGb": 16,
    "node": "v24.13.0",
    "ci": true
  },
  "axes": {
    "agent": {
      "status": "not-run",
      "reason": "not selected by --axis"
    }
  },
  "records": [],
  "bands": {
    "agent-tokens-per-task": {
      "status": "not-run",
      "reason": "not selected by --axis"
    },
    "agent-turns-per-task": {
      "status": "not-run",
      "reason": "not selected by --axis"
    }
  },
  "claims": {
    "agent-tokens-40pct": {
      "claim": "an agent spends at least 40% fewer tokens per task against a CLI that meets the floor",
      "source": ".sdlc/intents/agent-native-cli-layer/intent.md — the roadmap headline",
      "target": "<= 0.6",
      "status": "unmeasured",
      "reason": "not selected by --axis"
    },
    "agent-turns-30pct": {
      "claim": "an agent takes at least 30% fewer turns per task against a CLI that meets the floor",
      "source": ".sdlc/intents/agent-native-cli-layer/intent.md — the roadmap headline",
      "target": "<= 0.7",
      "status": "unmeasured",
      "reason": "not selected by --axis"
    }
  }
}
