{
  "schema": 1,
  "suite": "agent-cli-bench",
  "measured": "2026-10-09T19:51:41.072Z",
  "commit": "735f0f68048f2d0f5e4effad151ed5132b480bb8-dirty",
  "machine": {
    "os": "linux",
    "release": "6.17.0-1022-azure",
    "arch": "x64",
    "cpu": "Intel(R) Xeon(R) Platinum 8370C CPU @ 2.80GHz",
    "cores": 4,
    "memoryGb": 16,
    "node": "v24.13.0",
    "ci": true
  },
  "axes": {
    "agent": {
      "status": "not-run",
      "reason": "not selected by --axis"
    }
  },
  "records": [],
  "bands": {
    "agent-tokens-per-task": {
      "status": "not-run",
      "reason": "not selected by --axis"
    },
    "agent-turns-per-task": {
      "status": "not-run",
      "reason": "not selected by --axis"
    }
  },
  "claims": {
    "agent-tokens-40pct": {
      "claim": "an agent spends at least 40% fewer tokens over the benchmark tasks against a CLI that meets the floor (total over every task-run)",
      "source": ".sdlc/intents/burgee/intent.md — the roadmap headline; measured as totals since D-20261009-b1-totals-and-explain",
      "target": "<= 0.6",
      "status": "unmeasured",
      "reason": "not selected by --axis"
    },
    "agent-turns-30pct": {
      "claim": "an agent takes at least 30% fewer turns over the benchmark tasks against a CLI that meets the floor (total over every task-run)",
      "source": ".sdlc/intents/burgee/intent.md — the roadmap headline; measured as totals since D-20261009-b1-totals-and-explain",
      "target": "<= 0.7",
      "status": "unmeasured",
      "reason": "not selected by --axis"
    }
  }
}
